{
  "$schema": "https://json-schema.org/draft/2020-12/schema",
  "$id": "https://github.com/pilifs/in-the-loop/examples/schema/example.schema.json",
  "title": "Formal verification example (authored)",
  "description": "What a person writes for one example: the change, why it matters, and what the verifier should conclude. Everything the verifier produces lives in result.json, generated by tools/examples/build.py.",
  "type": "object",
  "required": ["id", "title", "summary", "categories", "severity", "subject", "approach", "change", "risk", "expected", "explanation", "resolution"],
  "additionalProperties": false,
  "properties": {
    "$schema": { "type": "string" },
    "id": { "description": "Three-digit number, equal to the folder prefix.", "type": "string", "pattern": "^[0-9]{3}$" },
    "title": { "description": "What happens, in one line. Shown in the table of contents.", "type": "string", "maxLength": 90 },
    "summary": { "description": "Two or three sentences for a reader skimming the table of contents.", "type": "string" },
    "categories": {
      "description": "What kind of breaking change the example is about.",
      "type": "array", "minItems": 1, "uniqueItems": true,
      "items": { "enum": ["functional", "security", "performance", "configuration", "determinism", "compatibility", "no-false-positive"] }
    },
    "severity": {
      "description": "How bad it would be if the change shipped unnoticed. 'none' for changes that are safe.",
      "enum": ["critical", "high", "medium", "low", "none"]
    },
    "subject": {
      "type": "object", "required": ["system", "file", "symbol"], "additionalProperties": false,
      "properties": {
        "system": { "description": "The application under verification.", "type": "string" },
        "file": { "description": "Repo-relative path of the changed source file.", "type": "string" },
        "symbol": { "description": "The verified unit, as <class>#<method>.", "type": "string" }
      }
    },
    "approach": {
      "type": "object", "required": ["id", "name", "tool"], "additionalProperties": false,
      "properties": {
        "id": { "description": "Approach ID in docs/approaches.md, for example B8.", "type": "string" },
        "name": { "type": "string" },
        "tool": { "description": "Repo-relative path of the verifier.", "type": "string" }
      }
    },
    "change": {
      "type": "object", "required": ["kind", "behaviourChangeIntended", "description", "patch"], "additionalProperties": false,
      "properties": {
        "kind": { "description": "What the developer thought they were doing.", "enum": ["refactor", "cleanup", "feature", "bug-fix", "logging", "dependency-upgrade", "configuration"] },
        "behaviourChangeIntended": { "description": "True if the developer meant to change behaviour, and so regenerates the contract.", "type": "boolean" },
        "description": { "description": "The change in the developer's words, and why it looked right.", "type": "string" },
        "patch": { "description": "Unified diff against the repo, relative to this folder.", "type": "string" }
      }
    },
    "risk": { "description": "What could go wrong in production if this change shipped unnoticed.", "type": "string" },
    "expected": {
      "type": "object", "required": ["verdict"], "additionalProperties": false,
      "properties": {
        "verdict": { "description": "The verdict the verifier must reach. The generator fails if it does not.", "enum": ["violation", "verified", "unverifiable"] }
      }
    },
    "explanation": { "description": "Why the verdict is right, and how the verifier reached it.", "type": "string" },
    "resolution": { "description": "What the developer should do next.", "type": "string" },
    "provenance": { "description": "Where the example came from: a real incident, a session, or constructed.", "type": "string" },
    "references": {
      "type": "array",
      "items": {
        "type": "object", "required": ["title", "url"], "additionalProperties": false,
        "properties": { "title": { "type": "string" }, "url": { "type": "string" } }
      }
    }
  }
}
